chunker,question,answer,num_chunks
paragraph,How many unintended pregnancies end in induced abortion?, Six out of 10 (61%) unintended pregnancies end in induced abortion.,4
paragraph,Who is Anemia a major public health concern for?," Anaemia is a major public health concern for children under 5 years of age, particularly infants and children under 2 years of age, menstruating adolescent girls and women, and pregnant and postpartum women. (Context provided)",4
paragraph,What is Autism?," Autism, mentioned in the context, refers to a condition on the autism spectrum disorder. It's a developmental and neurodevelopmental disorder that affects communication and behavior. People with autism typically have difficulties in social interaction, verbal and non-verbal communication, and show repetitive behaviors or narrow interests. However, the provided context does not give a detailed definition of autism itself.",4
paragraph,How many people are bitten by snakes worldwide every year?, Nearly 5 million people are bitten by snakes worldwide every year (as per the provided context).,4
paragraph,How many deaths were caused by alcohol consumption in 2019?," 2,600,000 deaths were caused by alcohol consumption in 2019.",4
